{
  "id": "octogent-child-agent-smoke",
  "title": "Octogent child-agent smoke",
  "created_at": "2026-05-30T08:00:00.000Z",
  "route": "octogent",
  "mode": "read_only",
  "cwd": "C:/Projects/octogent",
  "allowed_paths": [
    "C:/Projects/octogent"
  ],
  "objective": "Verify child-agent orchestration docs and tentacle model exist.",
  "inputs": {
    "doc_paths": [
      "docs/guides/orchestrating-child-agents.md",
      "docs/concepts/tentacles.md",
      "docs/reference/cli.md"
    ],
    "expected_terms": [
      "parentTerminalId",
      "todo.md",
      "shared",
      "worktree"
    ]
  },
  "expected_evidence": [
    "file_read",
    "log_trace"
  ],
  "safety": {
    "sandbox_required": false,
    "network_allowed": false,
    "write_allowed": false
  }
}
