{
  "id": "octogent-parent-swarm-loop-smoke",
  "title": "Octogent parent swarm loop smoke",
  "created_at": "2026-05-30T08:45:00.000Z",
  "route": "octogent",
  "mode": "read_only",
  "cwd": "C:/Projects/octogent",
  "allowed_paths": [
    "C:/Projects/octogent"
  ],
  "objective": "Verify parent and worker prompt templates for swarm coordination.",
  "inputs": {
    "doc_paths": [
      "prompts/swarm-parent.md",
      "prompts/swarm-worker.md",
      "docs/guides/working-with-todos.md",
      "docs/guides/orchestrating-child-agents.md"
    ],
    "expected_terms": [
      "spawn workers",
      "BLOCKED",
      "DONE",
      "todo item",
      "parent coordinator"
    ]
  },
  "expected_evidence": [
    "file_read",
    "log_trace"
  ],
  "safety": {
    "sandbox_required": false,
    "network_allowed": false,
    "write_allowed": false
  }
}
