{
  "id": "result-quality-evaluator-smoke",
  "title": "Result quality evaluator smoke",
  "created_at": "2026-06-01T00:00:00.000Z",
  "route": "manual",
  "mode": "read_only",
  "cwd": "C:/Users/user/OneDrive/Documents/GitHub/ANUS",
  "allowed_paths": [
    "C:/Users/user/OneDrive/Documents/GitHub/ANUS"
  ],
  "objective": "Verify judge pass can inspect prior operator result quality before any final claim.",
  "inputs": {
    "result_task_id": "octogent-live-child-ack-smoke"
  },
  "expected_evidence": [
    "file_exists",
    "file_read",
    "manual_note",
    "log_trace"
  ],
  "safety": {
    "sandbox_required": false,
    "network_allowed": false,
    "write_allowed": false
  }
}
