{
  "id": "octogent-worktree-smoke",
  "title": "Octogent worktree smoke",
  "created_at": "2026-05-30T08:30:00.000Z",
  "route": "octogent",
  "mode": "read_only",
  "cwd": "C:/Projects/octogent",
  "allowed_paths": [
    "C:/Projects/octogent"
  ],
  "objective": "Verify worktree isolation model and branch naming rules.",
  "inputs": {
    "doc_paths": [
      "docs/concepts/mental-model.md",
      "docs/reference/filesystem-layout.md",
      "docs/guides/orchestrating-child-agents.md"
    ],
    "expected_terms": [
      "worktree",
      ".octogent/worktrees",
      "octogent/<worker-terminal-id>",
      "shared"
    ]
  },
  "expected_evidence": [
    "file_read",
    "log_trace"
  ],
  "safety": {
    "sandbox_required": false,
    "network_allowed": false,
    "write_allowed": false
  }
}
